news,cluster
india lose 2nd test nz 3 day suffer test series whitewash 8 year,1
"coronavirus infect people 60 country 3,000 dead",1
sensex rise nearly 800 point asian market rebound,0
raveena take auto get late function say driver turn fan,0
reaction self defence yami criticism reject fan assamese scarf,0
riteish share pic blonde hair fan maharashtrian chris brown,0
bride mom groom dad run away wedding miss report,1
amazon employee test positive coronavirus italy,1
"63-yr old man tn spend rs6,000 daily free lunch 250 tribal",0
sc refuse refer petition challenge article 370 large bench,0
government allow airline provide flight wi fi service india,0
lie dad quit pay job start d fresh food co founder,0
houses muslims area include burn bjp akhtar raza,0
video 6 telangana policeman drink beer open snake dance,0
sc dismiss nirbhaya convict pawan gupta petition day hang,0
viral video show man pour whisky dry gujarat 6 book,0
12-yr old girl rape hang tree assam 7 class 10 student hold,0
elderly woman speak english mahatma gandhi video go viral,0
need oscar tell m jlo get nominate,0
irrfan want sympathy cancer want love angrezi medium director,0
akshay donate rs1.5 cr building home transgender chennai,0
richa ali fazal invite judi dench kenneth branagh wedding report,1
2 million tweet peddle conspiracy theory coronavirus report,1
tata motors mahindra indian operation affect coronavirus,1
